{
  "id": "proj_018f3c8e9b2a7c4d8f1e2a3b4c5d6e7f",
  "created_at": "2026-06-10T14:30:00Z",
  "operations": [
    {
      "operation_id": "op-1",
      "kind": "comment",
      "target": {
        "source_kind": "github_issue",
        "source_id": "UbU-project/ubu-schemas#1"
      },
      "summary": "Post progress update"
    }
  ],
  "policy_summary": {
    "legitimization": "accepted",
    "checked_at": "2026-06-10T14:30:01Z"
  }
}

